{
  "format_version": 1,
  "document_type": "index",
  "source": {
    "path": "examples/benchmark/the-lantern-house.md",
    "name": "the-lantern-house.md",
    "format": "markdown",
    "sha256": "866affb434a228f4b9da343a1777015898e53160ab94cabe3aa52899fe4f36df",
    "byte_length": 2565,
    "encoding": "utf-8",
    "available": true
  },
  "segmentation": {
    "ambiguous": false,
    "method": "explicit-chapter-title",
    "notes": [],
    "candidates": []
  },
  "counts": {
    "words": 483,
    "paragraphs": 25,
    "chapters": 4
  },
  "chapters": [
    {
      "id": "c001",
      "ordinal": 1,
      "title": "Chapter 1. The Attic Bargain",
      "role": "chapter",
      "paragraph_ids": [
        "p0001-a93f7fcb",
        "p0002-5301192b",
        "p0003-77d1bf48",
        "p0004-3addb449",
        "p0005-bf1e27e0",
        "p0006-fdc1cbff",
        "p0007-ca912f37",
        "p0008-a2a8dabe",
        "p0009-c055f756",
        "p0010-c7158939"
      ],
      "word_count": 196
    },
    {
      "id": "c002",
      "ordinal": 2,
      "title": "Chapter 2. The Letter",
      "role": "chapter",
      "paragraph_ids": [
        "p0011-352340d5",
        "p0012-92d34441",
        "p0013-63e32715",
        "p0014-276e81c7",
        "p0015-963b80ed",
        "p0016-7e807238"
      ],
      "word_count": 123
    },
    {
      "id": "c003",
      "ordinal": 3,
      "title": "Chapter 3. The Mirror",
      "role": "chapter",
      "paragraph_ids": [
        "p0017-55d373f9",
        "p0018-62924bea",
        "p0019-d15ea036",
        "p0020-a55b2b9c"
      ],
      "word_count": 81
    },
    {
      "id": "c004",
      "ordinal": 4,
      "title": "Chapter 4. What the Attic Held",
      "role": "chapter",
      "paragraph_ids": [
        "p0021-eec78d01",
        "p0022-3cb54ae3",
        "p0023-aceb760d",
        "p0024-20fd1449",
        "p0025-17626811"
      ],
      "word_count": 83
    }
  ],
  "paragraphs": [
    {
      "id": "p0001-a93f7fcb",
      "ordinal": 1,
      "chapter_id": "c001",
      "kind": "heading",
      "structural_role": "chapter-heading",
      "heading_level": 1,
      "heading_source": "markdown",
      "text": "Chapter 1. The Attic Bargain",
      "raw": "# Chapter 1. The Attic Bargain",
      "word_count": 5,
      "preview": "Chapter 1. The Attic Bargain"
    },
    {
      "id": "p0002-5301192b",
      "ordinal": 2,
      "chapter_id": "c001",
      "kind": "prose",
      "structural_role": "body",
      "heading_level": null,
      "heading_source": null,
      "text": "The rain reached the coast on Tuesday, 12 March, and turned the lane to the inn into a strip of black mud.",
      "raw": "The rain reached the coast on Tuesday, 12 March, and turned the lane to the inn into a strip of black mud.",
      "word_count": 22,
      "preview": "The rain reached the coast on Tuesday, 12 March, and turned the lane to the inn…"
    },
    {
      "id": "p0003-77d1bf48",
      "ordinal": 3,
      "chapter_id": "c001",
      "kind": "prose",
      "structural_role": "body",
      "heading_level": null,
      "heading_source": null,
      "text": "Elena pushed the door open. Her green eyes stung from the salt wind. She had come for one night and a dry book, nothing more.",
      "raw": "Elena pushed the door open. Her green eyes stung from the salt wind. She had come for one night and a dry book, nothing more.",
      "word_count": 25,
      "preview": "Elena pushed the door open. Her green eyes stung from the salt wind. She had co…"
    },
    {
      "id": "p0004-3addb449",
      "ordinal": 4,
      "chapter_id": "c001",
      "kind": "prose",
      "structural_role": "body",
      "heading_level": null,
      "heading_source": null,
      "text": "The inn had been founded in 1888. A brass plate said so beside the key rack, and Tomas wiped it with his sleeve as if the date might smear.",
      "raw": "The inn had been founded in 1888. A brass plate said so beside the key rack, and Tomas wiped it with his sleeve as if the date might smear.",
      "word_count": 29,
      "preview": "The inn had been founded in 1888. A brass plate said so beside the key rack, an…"
    },
    {
      "id": "p0005-bf1e27e0",
      "ordinal": 5,
      "chapter_id": "c001",
      "kind": "prose",
      "structural_role": "body",
      "heading_level": null,
      "heading_source": null,
      "text": "\"We are full,\" Tomas said.",
      "raw": "\"We are full,\" Tomas said.",
      "word_count": 5,
      "preview": "\"We are full,\" Tomas said."
    },
    {
      "id": "p0006-fdc1cbff",
      "ordinal": 6,
      "chapter_id": "c001",
      "kind": "prose",
      "structural_role": "body",
      "heading_level": null,
      "heading_source": null,
      "text": "\"Then I will sit in the kitchen until you are not.\"",
      "raw": "\"Then I will sit in the kitchen until you are not.\"",
      "word_count": 11,
      "preview": "\"Then I will sit in the kitchen until you are not.\""
    },
    {
      "id": "p0007-ca912f37",
      "ordinal": 7,
      "chapter_id": "c001",
      "kind": "prose",
      "structural_role": "body",
      "heading_level": null,
      "heading_source": null,
      "text": "He looked at the ledger, then at the water pooling under her boots. \"There is an attic. It leaks. Copy these pages before morning and the room is yours.\"",
      "raw": "He looked at the ledger, then at the water pooling under her boots. \"There is an attic. It leaks. Copy these pages before morning and the room is yours.\"",
      "word_count": 29,
      "preview": "He looked at the ledger, then at the water pooling under her boots. \"There is a…"
    },
    {
      "id": "p0008-a2a8dabe",
      "ordinal": 8,
      "chapter_id": "c001",
      "kind": "prose",
      "structural_role": "body",
      "heading_level": null,
      "heading_source": null,
      "text": "Elena set her wet gloves on the ledger and waited. She wanted the room. He wanted the pages copied. Neither of them named the price again.",
      "raw": "Elena set her wet gloves on the ledger and waited. She wanted the room. He wanted the pages copied. Neither of them named the price again.",
      "word_count": 26,
      "preview": "Elena set her wet gloves on the ledger and waited. She wanted the room. He want…"
    },
    {
      "id": "p0009-c055f756",
      "ordinal": 9,
      "chapter_id": "c001",
      "kind": "prose",
      "structural_role": "body",
      "heading_level": null,
      "heading_source": null,
      "text": "\"My brother Marco drowned in the inlet,\" Tomas said, once the soup was thin and the other guests had gone quiet. \"He could not swim. I do not talk about him.\"",
      "raw": "\"My brother Marco drowned in the inlet,\" Tomas said, once the soup was thin and the other guests had gone quiet. \"He could not swim. I do not talk about him.\"",
      "word_count": 31,
      "preview": "\"My brother Marco drowned in the inlet,\" Tomas said, once the soup was thin and…"
    },
    {
      "id": "p0010-c7158939",
      "ordinal": 10,
      "chapter_id": "c001",
      "kind": "prose",
      "structural_role": "body",
      "heading_level": null,
      "heading_source": null,
      "text": "Elena did not answer. The rain kept its own count against the shutters.",
      "raw": "Elena did not answer. The rain kept its own count against the shutters.",
      "word_count": 13,
      "preview": "Elena did not answer. The rain kept its own count against the shutters."
    },
    {
      "id": "p0011-352340d5",
      "ordinal": 11,
      "chapter_id": "c002",
      "kind": "heading",
      "structural_role": "chapter-heading",
      "heading_level": 1,
      "heading_source": "markdown",
      "text": "Chapter 2. The Letter",
      "raw": "# Chapter 2. The Letter",
      "word_count": 4,
      "preview": "Chapter 2. The Letter"
    },
    {
      "id": "p0012-92d34441",
      "ordinal": 12,
      "chapter_id": "c002",
      "kind": "prose",
      "structural_role": "body",
      "heading_level": null,
      "heading_source": null,
      "text": "On Wednesday, 12 March, the rain had not stopped.",
      "raw": "On Wednesday, 12 March, the rain had not stopped.",
      "word_count": 9,
      "preview": "On Wednesday, 12 March, the rain had not stopped."
    },
    {
      "id": "p0013-63e32715",
      "ordinal": 13,
      "chapter_id": "c002",
      "kind": "prose",
      "structural_role": "body",
      "heading_level": null,
      "heading_source": null,
      "text": "The inn had been founded in 1888.",
      "raw": "The inn had been founded in 1888.",
      "word_count": 7,
      "preview": "The inn had been founded in 1888."
    },
    {
      "id": "p0014-276e81c7",
      "ordinal": 14,
      "chapter_id": "c002",
      "kind": "prose",
      "structural_role": "body",
      "heading_level": null,
      "heading_source": null,
      "text": "Elena dried the ledger with her cuff. In the winter before this storm, on a clear Monday with no rain at all, she had stood in the same lane and turned back. That Monday was months ago. It was not this storm, and it was not the day of the letter.",
      "raw": "Elena dried the ledger with her cuff. In the winter before this storm, on a clear Monday with no rain at all, she had stood in the same lane and turned back. That Monday was months ago. It was not this storm, and it was not the day of the letter.",
      "word_count": 51,
      "preview": "Elena dried the ledger with her cuff. In the winter before this storm, on a cle…"
    },
    {
      "id": "p0015-963b80ed",
      "ordinal": 15,
      "chapter_id": "c002",
      "kind": "prose",
      "structural_role": "body",
      "heading_level": null,
      "heading_source": null,
      "text": "A letter came at dusk. Tomas set it on the bar and did not open it. The last line was plain enough from where Elena stood: \"I am in the capital. Do not tell them I can still write. — Marco\"",